root@Georgebrown:~# tcpdump -n -i eth0
tcpdump: verbose output suppressed, use -v[v]... for full protocol decode
listening on eth0, link-type EN10MB (Ethernet), snapshot length 262144 bytes
20:48:56.567600 IP 138.197.142.227.22 > 198.96.85.21.52874: Flags [P.], seq 1714795139:1714795191, ack 2162642399, win 501, length 52
20:48:56.569136 IP 138.197.142.227.22 > 198.96.85.21.52874: Flags [P.], seq 52:160, ack 1, win 501, length 108
20:48:56.569192 IP 138.197.142.227.22 > 198.96.85.21.52874: Flags [P.], seq 160:196, ack 1, win 501, length 36
20:48:56.569229 IP 138.197.142.227.22 > 198.96.85.21.52874: Flags [P.], seq 196:248, ack 1, win 501, length 52
20:48:56.569262 IP 138.197.142.227.22 > 198.96.85.21.52874: Flags [P.], seq 248:316, ack 1, win 501, length 68
20:48:56.569294 IP 138.197.142.227.22 > 198.96.85.21.52874: Flags [P.], seq 316:384, ack 1, win 501, length 68
20:48:56.569324 IP 138.197.142.227.22 > 198.96.85.21.52874: Flags [P.], seq 384:420, ack 1, win 501, length 36
20:48:56.572682 IP 198.96.85.21.52874 > 138.197.142.227.22: Flags [.], ack 420, win 1020, length 0
20:48:56.666960 IP 138.197.142.227.22 > 198.96.85.21.52874: Flags [P.], seq 420:592, ack 1, win 501, length 172
20:48:56.667047 IP 138.197.142.227.22 > 198.96.85.21.52874: Flags [P.], seq 592:776, ack 1, win 501, length 184
20:48:56.667083 IP 138.197.142.227.22 > 198.96.85.21.52874: Flags [P.], seq 776:812, ack 1, win 501, length 36
20:48:56.667122 IP 138.197.142.227.22 > 198.96.85.21.52874: Flags [P.], seq 812:960, ack 1, win 501, length 148
20:48:56.667149 IP 138.197.142.227.22 > 198.96.85.21.52874: Flags [P.], seq 960:996, ack 1, win 501, length 36
20:48:56.667185 IP 138.197.142.227.22 > 198.96.85.21.52874: Flags [P.], seq 996:1144, ack 1, win 501, length 148
20:48:56.667211 IP 138.197.142.227.22 > 198.96.85.21.52874: Flags [P.], seq 1144:1180, ack 1, win 501, length 36
20:48:56.667245 IP 138.197.142.227.22 > 198.96.85.21.52874: Flags [P.], seq 1180:1328, ack 1, win 501, length 148
20:48:56.667278 IP 138.197.142.227.22 > 198.96.85.21.52874: Flags [P.], seq 1328:1364, ack 1, win 501, length 36
20:48:56.667314 IP 138.197.142.227.22 > 198.96.85.21.52874: Flags [P.], seq 1364:1512, ack 1, win 501, length 148
20:48:56.667340 IP 138.197.142.227.22 > 198.96.85.21.52874: Flags [P.], seq 1512:1548, ack 1, win 501, length 36
20:48:56.667375 IP 138.197.142.227.22 > 198.96.85.21.52874: Flags [P.], seq 1548:1696, ack 1, win 501, length 148
20:48:56.667403 IP 138.197.142.227.22 > 198.96.85.21.52874: Flags [P.], seq 1696:1732, ack 1, win 501, length 36
20:48:56.667438 IP 138.197.142.227.22 > 198.96.85.21.52874: Flags [P.], seq 1732:1864, ack 1, win 501, length 132
20:48:56.667465 IP 138.197.142.227.22 > 198.96.85.21.52874: Flags [P.], seq 1864:1900, ack 1, win 501, length 36
20:48:56.670752 IP 198.96.85.21.52874 > 138.197.142.227.22: Flags [.], ack 1900, win 1023, length 0
20:48:56.770766 IP 138.197.142.227.22 > 198.96.85.21.52874: Flags [P.], seq 1900:2048, ack 1, win 501, length 148
20:48:56.770835 IP 138.197.142.227.22 > 198.96.85.21.52874: Flags [P.], seq 2048:2084, ack 1, win 501, length 36
20:48:56.770877 IP 138.197.142.227.22 > 198.96.85.21.52874: Flags [P.], seq 2084:2232, ack 1, win 501, length 148
20:48:56.770906 IP 138.197.142.227.22 > 198.96.85.21.52874: Flags [P.], seq 2232:2268, ack 1, win 501, length 36
20:48:56.770943 IP 138.197.142.227.22 > 198.96.85.21.52874: Flags [P.], seq 2268:2416, ack 1, win 501, length 148
20:48:56.770970 IP 138.197.142.227.22 > 198.96.85.21.52874: Flags [P.], seq 2416:2452, ack 1, win 501, length 36
20:48:56.771003 IP 138.197.142.227.22 > 198.96.85.21.52874: Flags [P.], seq 2452:2600, ack 1, win 501, length 148
20:48:56.771131 IP 138.197.142.227.22 > 198.96.85.21.52874: Flags [P.], seq 2600:3188, ack 1, win 501, length 588
20:48:56.771164 IP 138.197.142.227.22 > 198.96.85.21.52874: Flags [P.], seq 3188:3336, ack 1, win 501, length 148
20:48:56.771191 IP 138.197.142.227.22 > 198.96.85.21.52874: Flags [P.], seq 3336:3372, ack 1, win 501, length 36
20:48:56.771225 IP 138.197.142.227.22 > 198.96.85.21.52874: Flags [P.], seq 3372:3520, ack 1, win 501, length 148
20:48:56.771252 IP 138.197.142.227.22 > 198.96.85.21.52874: Flags [P.], seq 3520:3556, ack 1, win 501, length 36
20:48:56.771287 IP 138.197.142.227.22 > 198.96.85.21.52874: Flags [P.], seq 3556:3704, ack 1, win 501, length 148
20:48:56.771314 IP 138.197.142.227.22 > 198.96.85.21.52874: Flags [P.], seq 3704:3740, ack 1, win 501, length 36
20:48:56.771349 IP 138.197.142.227.22 > 198.96.85.21.52874: Flags [P.], seq 3740:3888, ack 1, win 501, length 148
20:48:56.771375 IP 138.197.142.227.22 > 198.96.85.21.52874: Flags [P.], seq 3888:3924, ack 1, win 501, length 36
20:48:56.771410 IP 138.197.142.227.22 > 198.96.85.21.52874: Flags [P.], seq 3924:4072, ack 1, win 501, length 148
20:48:56.771435 IP 138.197.142.227.22 > 198.96.85.21.52874: Flags [P.], seq 4072:4108, ack 1, win 501, length 36
20:48:56.771471 IP 138.197.142.227.22 > 198.96.85.21.52874: Flags [P.], seq 4108:4256, ack 1, win 501, length 148
20:48:56.771521 IP 138.197.142.227.22 > 198.96.85.21.52874: Flags [P.], seq 4256:4440, ack 1, win 501, length 184
20:48:56.771577 IP 138.197.142.227.22 > 198.96.85.21.52874: Flags [P.], seq 4440:4624, ack 1, win 501, length 184
20:48:56.771599 IP 138.197.142.227.22 > 198.96.85.21.52874: Flags [P.], seq 4624:4660, ack 1, win 501, length 36
20:48:56.771641 IP 138.197.142.227.22 > 198.96.85.21.52874: Flags [P.], seq 4660:4800, ack 1, win 501, length 140
20:48:56.771679 IP 138.197.142.227.22 > 198.96.85.21.52874: Flags [P.], seq 4800:4836, ack 1, win 501, length 36
20:48:56.774953 IP 198.96.85.21.52874 > 138.197.142.227.22: Flags [.], ack 4108, win 1023, length 0
20:48:56.774953 IP 198.96.85.21.52874 > 138.197.142.227.22: Flags [.], ack 4836, win 1021, length 0
20:48:56.777584 IP 198.96.85.21.52874 > 138.197.142.227.22: Flags [P.], seq 1:37, ack 4836, win 1021, length 36
20:48:56.818644 IP 138.197.142.227.22 > 198.96.85.21.52874: Flags [.], ack 37, win 501, length 0
^C
52 packets captured
112 packets received by filter
0 packets dropped by kernel
